note,tags,folder,current_folder,ai_suggested_folder,url
Tasia M S imagines The Lion King characters as humans.,"art,celebrity lore,fandom",art appreciation,art appreciation,Animation,https://www.instagram.com/reel/C_VU3SWsDPV/?igsh=b2tpMTFxenh5bmZt
broken link,delete,delete,music,Music,https://www.instagram.com/reel/ClpDGHMvRl5?igshid=MDJmNzVkMjY=
Painting process of a custom Ariana Grande denim jacket on Instagram.,"art,business,fashion",fashion,fashion,Content Creation,https://www.instagram.com/reel/CqYQ_0cAHq7?igshid=ZTlkMDEyOTY=
Understand the symbolism of the rat with Hindu god Ganesha.,"hinduism,spirituality",spirituality,spirituality,Celebrity Lore,https://www.quora.com/What-is-the-significance-of-the-rat-to-the-Hindu-god-Ganesha
Bookmark link to Guide to Dreams on Facebook.,spirituality,spirituality,aesthetics,Suggestion - Dreams,https://m.facebook.com/guidetodreams
Jared creates a Name-to-Color formula for fun on Instagram.,"art tutorials,design",design,art tutorials,Art,https://www.instagram.com/reel/C--dKqZuYMS/?igsh=bjVsc3czM3k0NTZh
Custom top creation by Kale Maille shared on Instagram.,fashion,fashion,fashion,Fashion,https://www.facebook.com/groups/425351158406372/permalink/1038093520465463
haikyuu fanart ,"anime,art tutorials",art tutorials,art appreciation,Suggest new folder: Social Media Links,https://www.instagram.com/p/CQS7weOA9yy?igshid=ZDhmZGIxNmQ=
animation of typewriter done on digital art,art tutorials,art tutorials,art appreciation,suggestion pending,https://www.facebook.com/reel/1102917967734250
beautiful vocals- shamanic chanting sakha and the tree Sakha shamanic chanting harmonizes beautifully with nature.,"music,music appreciation",music,music,Music,https://www.facebook.com/watch?ref=saved&v=947516072799036
broken link,delete,delete,positioning,Content Creation,https://www.instagram.com/reel/C1QVc1fg7in?igsh=NTA5c3BxeXdyMGE=
A popular post showcasing a smart alpaca named Choco.,animals,animals,art appreciation,Content Creation,https://www.instagram.com/reel/C9o_JYUvzsA?igsh=MTF3a2JxMHVzeWh4cQ==
broken link,delete,delete,art appreciation,Content Creation,https://www.instagram.com/reel/CrBKwoQrHN8?igshid=MDJmNzVkMjY=
broken link,delete,delete,content creation,Social Trends,https://www.instagram.com/p/CiqRSMrMVc0?igshid=MDJmNzVkMjY=
Tutorial on creating shuffle play video effects for Instagram Reels.,"content creation,video editing",video editing,video editing,Content Creation,https://www.instagram.com/reel/C5dAXXWsIP9?igsh=MWNlcTZlaWV6aWNzdg==
Mitchie contemplates adult life milestones and achievements.,mindset,mindset,mindset,Lifestyle Design,https://www.instagram.com/reel/C4GziR2S4pP?igsh=dXAxNzZtdDc5aDB2
anok yai’s met gala appearance - Swarovski crystals and carats for a stunning look.,"celebrity lore,high fashion",fashion,aesthetics,Fashion,https://www.instagram.com/p/C6pqh4WsQNW?igsh=aXk5cTM1MGUwZHkz
quote about validating colour and beauty standards,"beauty,body positivity,politics",politics,art appreciation,Art,https://www.instagram.com/p/B3ixoApFTqH?igshid=ZTlkMDEyOTY=
biggest turn on is when he knows to shut up and listen,"masculinity,relationships",masculinity,visuals,Celebrity Lore,https://www.instagram.com/p/CuJREa9SIVK?igshid=MTc4MmM1YmI2Ng==
K-pop idol makeup tip for flatter facial structure.,beauty,beauty,beauty,Beauty,https://www.instagram.com/reel/C68y-DusRWs?igsh=MXhkdndvenpjbDEx
broken link,delete,delete,design,Suggestion - Technology,http://api-shein.shein.com/h5/sharejump/appjump?link=V4SbHGjZV7H&localcountry=ZA&url_from=GM7476683819513741312
Experience an intense core workout with Hayeon Song.,"fitness,workouts",fitness,fitness,Fitness,https://www.instagram.com/reel/C6WGveQrha3?igsh=MW10bjA3aHo4M2Yycw==
Showcasing ROSIE Beauty Lab in Azerbaijan by Le Masculin F�minin.,architecture,architecture,art appreciation,Beauty,https://www.instagram.com/p/B1Oc2tbHALC?igshid=ZTlkMDEyOTY=
Natalia Vodianova photographed by Mert & Marcus in a Vogue editorial.,"high fashion,photography",photography,wholesome,Photography,http://www.fashiongonerogue.com/morning-beauty-natalia-vodianova-mert-marcus?crlt.pid=camp.l4FLcs9IbYxQ
broken link,delete,delete,content creation,Content Creation,https://www.instagram.com/reel/Cpp8NpyhnIj?igshid=MDJmNzVkMjY=
broken link,delete,delete,visuals,Photography,https://www.instagram.com/reel/Cz1XR8tK9I9?igshid=MTc4MmM1YmI2Ng==
broken link,delete,delete,content creation,Content Creation,https://www.facebook.com/100057088164150/posts/460545239191744?d=n
5 explicit emotional boundaries Instagram post about the importance of clear emotional boundaries.,"communication,mental health,relationships",relationships,relationships,Link-Only,https://www.instagram.com/p/C4L2knDPf_L?igsh=MWFsaDJnY2Z3Z2g1cA==
"""The House of the Rising Sun"" by The Animals, a 1964 rock classic.",music,music,animals,Music,https://www.youtube.com/watch?v=PqW4GCmQSt4
Repeated encouraging mental health post with dinosaurs.,mental health,mental health,k-pop,Content Creation,https://www.instagram.com/p/C9KK2QqRVrC?igsh=MWphb2VmOHVqc2psNQ==
Instagram post about Blue Period with secret Santa theme.,"anime,edits",edits,art appreciation,Content Creation,https://www.instagram.com/p/CX6luTIMFiE?igshid=ZDhmZGIxNmQ=
“you look like a girl” as an insult ,"feminism,masculinity,politics",politics,visuals,Celebrity Lore,https://www.instagram.com/reel/C3JDe3DSeus?igsh=MW5naWYweGdrcGFicA==
Explore eerie yet historical photos voted by fans.,"history,photography",history,history,Photography,https://www.ranker.com/list/unintentionally-creepy-old-photos/brenden-donnelly?fbclid=IwAR3rrRyXuQURvNB_WjkwRYVG5qcSVqXerQZTK4ZGtueAuAr-QJasVdVo6ug
"Creative edit of Duo Ackerman on Instagram, marked with various hashtags.","anime,edits",edits,aesthetics,Content Creation,https://www.instagram.com/p/CML9oQmhITX?igshid=ZDhmZGIxNmQ=
Library transformation with fae-inspired propaganda touches.,"aesthetics,architecture,home",home,design,Home,https://m.facebook.com/groups/fae.propaganda/permalink/1120128535226691?mibextid=CtpNnY
"A fun street portrait session in Coal Harbour with a laughing couple, creating joyful and spontaneous images.","couple goals,relationships",relationships,wedding,Photography,https://www.instagram.com/reel/C5uXA7lRel2?igsh=OXJ4MjNqYjRiY2Jx
broken link,delete,delete,k-pop,Content Creation,https://www.instagram.com/reel/C6J4G7zJm5N?igsh=MWg4YTl6a3h1YXI5Mw==
broken link,delete,delete,literature,Content Creation,https://www.instagram.com/p/CCAt9k8AKAR?igshid=ZTlkMDEyOTY=
broken link,delete,delete,history,Beauty,https://www.instagram.com/reel/C30bP9BJ21u?igsh=MXd0aW9leWJza3JhNw==
broken link,delete,delete,fashion,Fashion,https://www.instagram.com/reel/C2a-wjqPDVJ?igsh=MW5nMzgwb2dna2drbQ==
Tyler the Creator on authenticity in creativity across music and anime.,mindset,mindset,musician precedents,Content Creation,https://www.instagram.com/reel/C_abW0vS2QL/?igsh=Nm8yeDhjdWllNjlp
Engaging content on Instagram with no specific topic outlined.,"impressive,sports",sports,fitness,Content Creation,https://www.instagram.com/reel/C9U0XbJhi9W/?igsh=ZDh4bmRweDJqNzBo
Explains a communication method for making someone feel heard.,"communication,social",social skills,profiling,Friendship,https://www.instagram.com/reel/C1I0m3HvgqQ?igsh=MTdhcHZwb3E5NTFseA==
broken link,delete,delete,bucket list,Link-Only,https://www.instagram.com/reel/CrJBKvkghnW?igshid=MDJmNzVkMjY=
"A Taylor Swift quote on toxic relationships, shared by quotelectures on Instagram for more motivational content.","philosophy,social",philosophy,literature,Content Creation,https://www.instagram.com/reel/CnDYVPWp38E?igshid=ZTlkMDEyOTY=
Explore financial aid and scholarship options for international students in Germany.,"career,jobs",career,money,Academia,https://www.cbs.de/en/financial-aid
Six public figures took a color test in 1970 choosing colors like calming blue.,profiling,profiling,art tutorials,Content Creation,https://www.theguardian.com/lifeandstyle/2021/nov/14/from-the-archive-a-colourful-personality-test-1970
Black lip color becomes a favorite everyday choice with Givenchy gloss.,beauty,beauty,history,Beauty,https://www.instagram.com/reel/Cgrp-lagqda?igshid=MDJmNzVkMjY=
broken link,delete,delete,content creation,Content Creation,https://www.instagram.com/reel/C5Npjr_h_mq?igsh=MWpiMmV5dTVnZThyag==
NASA studied how drugs affect spider web construction in 1995.,"animals,frontier,nature",space,space,Nature,https://www.facebook.com/thingsfrompast/posts/pfbid02fff3q8Pkaiqzx2uzkoaaQowtNpoyzZZJ4SPXp4cbMb3ZMQVLGHfUJLE5L2zqEwRJl
Alternative goth makeup look with neon and goth styles.,cosplay,cosplay,fashion,Beauty,https://www.instagram.com/p/B0yhuqgo4-T?igshid=ZTlkMDEyOTY=
Discussion on the 1948 Toko Tone in the AnalogCommunity.,"history,photography",photography,space,Photography,https://www.reddit.com/r/AnalogCommunity/comments/152zuzw/review_of_the_toko_tone_1948_link_in_comments/
broken link,delete,delete,home,Suggested: Service Plans,https://www.inoreader.com/pricing
Wesley Anna aims to bring fun back to the internet through engaging content.,"content creation,precedents",content creation,mindset,Content Creation,https://www.youtube.com/@WesleyAnna
Sacra Luna showcases upcoming Crystal Moon Mirrors.,"aesthetics,business",aesthetics,art appreciation,Art,https://www.instagram.com/p/B1O8hSNglbi?igshid=ZTlkMDEyOTY=
Kendall shares a minimalist post engaging with her followers.,history,mindset,mindset,Content Creation,https://www.instagram.com/p/B9UKGnyHrlU?igshid=ZTlkMDEyOTY=
pranking grandfather with extendable fork,"challenges,funny",challenges,gifts,Suggest new folder: Celebrations,https://www.instagram.com/reel/C8Q3OIPS8l4?igsh=MTU4N2N5czIxMzJwaw==
Fantasy-inspired angel makeup for a creative look.,cosplay,cosplay,art appreciation,Beauty,https://www.instagram.com/reel/C5_1Yv5ynRr?igsh=Nnk2djlnZTA5NHVq
"A guide on personal organization with mental models, Part II.",productivity,productivity systems,mental health,Content Creation,https://www.reddit.com/r/productivity/comments/k00lek/a_mental_model_for_personal_organization_part_ii
layered online hair salon,hair,hair,content creation,Suggest: Social Media,https://www.layeredonline.com/colour
broken link,delete,delete,positioning,Content Creation,https://www.instagram.com/p/Cs8yiX8tOdO?igsh=MTc4MmM1YmI2Ng==
"Imagining Shoto Todoroki as your boyfriend, part of a series of character headcanons.","anime,edits,relationships",edits,wholesome,Celebrity Lore,https://www.instagram.com/p/CKWR9v6pWJO?igshid=MDJmNzVkMjY=
broken link,delete,delete,positioning,Content Creation,https://www.instagram.com/reel/CqgEpURpHtX?igshid=MDJmNzVkMjY=
The 90/90/1 rule - Google Search,mindset,mindset,profiling,Link-Only,https://www.google.com/search?gs_lcrp=EgZjaHJvbWUyBggAEEUYOTIGCAEQRRg8MgYIAhBFGDzSAQc1MDdqMGoxqAIAsAIA&ie=UTF-8&oq=The+90/90/1+rule&q=The+90/90/1+rule&rlz=1C1ONGR_enZA1109ZA1109&sourceid=chrome
Study on ultraflexible temperature sensors for multipoint measurements.,"academia,frontier",frontier,health,Health,https://www.pnas.org/doi/10.1073/pnas.1515650112
"Future Learning Environments by Tengbom in Solna, Sweden.",architecture,architecture,bucket list,Travel Locations,http://retaildesignblog.net/2013/09/10/future-learning-environments-by-tengbom-solna-sweden
Duo plants wildflowers to rejuvenate neglected land.,"environment,garden",frontier,history,Nature,https://fb.watch/cGsIbwNaiQ
A sacred 800-year-old cedar tree called the Chichi-sugi Tree in Japan.,"bucket list,environment,history,nature",history,language,Travel Locations,https://www.facebook.com/331076697652789/posts/1154360708657713?d=n
look happier- okay i’m trying ,"about me,funny,memes",about me,literature,Content Creation,https://www.instagram.com/reel/Ch6KiBbDiRc?igshid=ZDhmZGIxNmQ=
Scholarships for African students to study postgrad in South Africa.,career,career,career,Academia,https://www.zabursaries.co.za/mba-postgraduate/mandela-rhodes-foundation-scholarship
NYX highlights a graphic eye look using their On The Rise Volume Liftscara.,cosplay,cosplay,beauty,Beauty,https://www.instagram.com/p/B2oYE_Tg-fC?igshid=ZTlkMDEyOTY=
"""Aisi Dooriyaan"" by Himonshu Parikh explores themes of separation.","indian,music",music,music,Music,https://www.youtube.com/watch?v=gr2iLIbNV2o
broken link,delete,delete,content creation,Content Creation,https://www.instagram.com/p/CrUXu5rNBHq?igshid=MDJmNzVkMjY=
Coline Cherry shares a digital take on the Met Gala's Gilded Glamour theme.,"art,design,high fashion",fashion,wholesome,Fashion,https://www.instagram.com/p/CdJE-zFKvwy?igshid=MDJmNzVkMjY=
Compilation of beautiful and uncommon words to enhance writing skills.,literature,literature,language,Content Creation,https://www.instagram.com/reel/CttgkY1AyLH?igshid=MTc4MmM1YmI2Ng==
Hogan McLaughlin shows liquid organza daywear for spring/summer 2019.,high fashion,fashion,fashion,Fashion,https://www.instagram.com/p/BxnISO0hH3x?igshid=ZTlkMDEyOTY=
Opal Bling Crocs add a sparkling touch to your footwear style.,fashion,fashion,fashion,Fashion,https://www.etsy.com/listing/940473533/opal-bling-crocs?frs=1&ref=internal_similar_listing_bot-1
"Stunning balayage ideas for black hair, trending in 2022.",hair,hair,hair,Beauty,https://www.momooze.com/balayage-on-black-hair
Get 50+ spooky and cool Halloween nail designs for 2024.,beauty,beauty,aesthetics,Beauty,https://lifestylewithamal.com/cool-halloween-nail-designs
Catalina shares doodling struggles and favorite color combinations in makeup.,cosplay,cosplay,skincare,Art,https://www.instagram.com/p/B2PXTV8IcHl?igshid=ZTlkMDEyOTY=
Obsessed with Versace highlights Amit Aggarwal's powerful runway show at Lakme Fashion Week.,high fashion,fashion,fashion,Fashion,https://www.instagram.com/reel/CojThYku8sJ?igshid=ZTlkMDEyOTY=
broken link,delete,delete,art appreciation,Content Creation,https://www.instagram.com/tv/CctRFkPlf-W?igshid=YmMyMTA2M2Y=
if your child is provoking you for sport try the one minute chase,parenting,parenting,aesthetics,Lifestyle Design,https://www.facebook.com/share/r/KSr6pUm4R294LouB?mibextid=0VwfS7
Learn about the popular wine hair-color trend for striking purple hues.,hair,hair,fashion,Beauty,https://www.allure.com/story/wine-purple-hair-color-trend?verso=true
broken link,delete,delete,aesthetics,Photography,https://www.instagram.com/followintheirfootsteps
mark ruffalo accepting a fumble request to answer sexist questions,"celebrity lore,feminism,wholesome",celebrity lore,art appreciation,Content Creation,https://www.instagram.com/p/B9_ZvJQpyzH?igshid=ZTlkMDEyOTY=
broken link,delete,delete,aesthetics,Photography,http://parishotelboutique.blogspot.com/2010/08/inspiring-imagesturquoise.html
Instagram post speculating Sokka and Azula interaction using TikTok content.,"animation,art tutorials",art tutorials,visuals,Content Creation,https://www.instagram.com/reel/CGiPSG3naW0?igshid=ZDhmZGIxNmQ=
Shannon Coleman discusses how millennial parenting impacts adult self-esteem.,"mental,mental health",mental health,mindset,Parenting,https://www.instagram.com/reel/C715njFKUGM?igsh=dXB0azU1a3JyYXQ4
Program offering scholarships to South African students.,career,career,career,Academia,https://southafrica-france-scholarships.com
broken link,delete,delete,content creation,Content Creation,https://www.carryology.com/community
broken link,delete,delete,art appreciation,Content Creation,https://www.instagram.com/p/B5ymma4lOml?igshid=ZTlkMDEyOTY=
Nostalgic Instagram post from Akira about not visiting Japan for a decade.,about me,about me,visuals,Content Creation,https://www.instagram.com/p/BJdJmXuBbhx/?igsh=ZDdncTd2a2puZ3pz
Althea reviews a classic novel on self-discovery through lovers.,literature,literature,literature,Literature,https://www.instagram.com/reel/C7oa5ROydDu
Enhance sensuality through a bachata-inspired dance program.,"dance,reading",dance,dance trends,Dance,https://ready.kristinamikolcic.com/unlock-your-sensuality-by-km2021b
broken link,delete,delete,profiling,Content Creation,https://www.collider.space/complex-geopolitics/
"Minimalist triangle septum ring with gold vermeil, fitting snugly and offering a modern geometric look.","fashion,jewellery",fashion,fashion,Beauty,https://eleven44.com/collections/septum-nose-rings/products/triangle-septum-gold
Framework for understanding sleep and emotion regulation.,health,health,profiling,Academia,https://link.springer.com/article/10.1007/s11920-014-0500-x
Celebrating the elegance of Chopard jewellery blogger post.,"fashion,jewellery",fashion,aesthetics,Fashion,https://www.instagram.com/reel/CZMB3U_oS3D?igshid=MDJmNzVkMjY=
"Kingston 500G portable SSD with USB-C, up to 2000MB/s speed.","productivity,wishlist",productivity systems,design,Content Creation,https://www.amazon.com/dp/B09F5WJV8R?ascsubtag=v7_3_1ej_4hxx_654j_0_x01_-srt-&tag=097-20
Just Sharon uses AI for color analysis; promotes self-love and confidence.,"beauty,lifestyle design,personal style",beauty,profiling,Beauty,https://www.instagram.com/reel/C4Y3gO0PwCL?igsh=MXY1dWluZjc4bnp6aw==
Discover trendy hipster neighborhoods globally.,"bucket list,travel locations",bucket list,travel,Travel Locations,https://www.businessinsider.com/hipster-neighborhoods-around-the-world-2016-9
Explaining salvageable goods and their impact on communities.,"environment,frontier",frontier,travel,Travel Locations,https://www.instagram.com/p/CpKIlrXs7dk?igshid=MDJmNzVkMjY=
"Iconic scene from ""Goblin"" celebrated on Instagram.","edits,funny,kdrama",edits,celebrity lore,K-pop,https://www.instagram.com/reel/CjV8mVzAllK?igshid=ZDhmZGIxNmQ=
sokka fan art,"animation,art tutorials",art tutorials,art appreciation,ATLA,https://www.instagram.com/p/CBmKOYAjRq6?igshid=ZTlkMDEyOTY=
why do we choose to love? ,"humanity,literature,love",philosophy,art appreciation,Content Creation,https://www.instagram.com/p/C_lE0F5Mq7M/?igsh=M2h1MTlyMTVjbzZs
broken link,delete,delete,music,Music,https://www.instagram.com/reel/CqewBB3g1rd?igshid=MDJmNzVkMjY=
Reflective post about moonlight and memories with Chinese music themes.,music,music,art appreciation,Music,https://www.instagram.com/reel/Cr0FI_FgbVp?igshid=MTc4MmM1YmI2Ng==
broken link,delete,delete,design,Design,https://www.instagram.com/p/DA3z7XTAFZG/?img_index=5&igsh=Z2wzcTZkMjBiMzR0
broken link,delete,delete,architecture,Photography,https://www.instagram.com/tv/B_-fXCQDC7A?igshid=ZTlkMDEyOTY=
broken link,delete,delete,design,Link-Only,https://www.facebook.com/KYLAniones.2/videos/465376235284408?d=n
Key rules for high emotional intelligence in conversations.,"communication,social",social skills,relationships,Content Creation,https://www.inc.com/bill-murphy-jr/people-who-use7-these-key-rulesin-conversationshave-very-high-emotional-intelligence.html
Overview of the Kowtow Shelter Anorak.,architecture,architecture,art appreciation,Fashion,https://www.garmentory.com/shop/672634-kowtow-shelter-anorak?dp=sand-canvas
"Audio cleaning hacks for ADHD, combining routines with entertainment.","adhd,lifestyle design",lifestyle design,design,Content Creation,https://www.instagram.com/reel/C9FGHv-p94p?igsh=MThudHU0MWdueGtsYw==
broken link,delete,delete,profiling,Literature,https://www.instagram.com/p/C14dXQ8Ob-j?igsh=MTVoMTVsMm5vdGZncA==
Josh Czuba shares an Instagram post with a focus on narrative over content.,"content creation,philosophy,precedents",content creation,visuals,Content Creation,https://www.instagram.com/reel/C4lSxM_Onio?igsh=eDN5d3ZvaXhtajZw
broken link,delete,delete,games,Memes,https://www.instagram.com/p/CBom-J7pU2z?igshid=ZTlkMDEyOTY=
"TARQ, a contemporary art gallery in Mumbai, bridges historical urban textures.",architecture,architecture,art appreciation,Art,https://www.archdaily.com/1007694/tarq-gallery-squareworks
Trends and impacts of immigration in South Africa.,"academia,culture,history",history,language,Academia,https://en.wikipedia.org/wiki/Immigration_to_South_Africa
broken link,delete,delete,content creation,Content Creation,https://www.instagram.com/reel/CEfjgldHpXB?igshid=ZTlkMDEyOTY=
broken link,delete,delete,challenges,Challenges,https://www.instagram.com/p/B-GmLe8nBrm?igshid=ZTlkMDEyOTY=
Material girls exploring Paris at Baccarat Crystal room.,"bucket list,travel locations",bucket list,space,Travel Locations,https://www.instagram.com/reel/CdU4mgeA3pl?igshid=MDJmNzVkMjY=
broken link,delete,delete,fashion,Fashion,https://www.instagram.com/p/B9FePAXFoPL?igshid=ZTlkMDEyOTY=
Omotayo celebrates Yoruba goddess Osun with a dance video and music.,"consciousness,spirituality",spirituality,dance appreciation,Music,https://www.instagram.com/reel/C_QV1_nyPeE/?igsh=MXV2cXk1ZmNlc3lsMw==
Sold antique moonstone jewelry listed on Etsy by Epilogue.,"aesthetics,fashion,rings",fashion,history,Fashion,https://www.instagram.com/p/CMLSc4ilgsG?igshid=MDJmNzVkMjY=
broken link,delete,delete,visuals,Fashion,https://www.instagram.com/reel/C6W1PDOvY3G?igsh=ajY0NnF0ajFxOTk4
broken link,delete,delete,videos to recreate,Content Creation,https://www.instagram.com/reel/C2HDU0sPMsn?igsh=eHJzaTJlbDFtaTdn
broken link,delete,delete,art appreciation,Beauty,https://www.instagram.com/p/CJjgzTgl0Tm?igshid=MDJmNzVkMjY=
broken link,delete,delete,fashion,Fashion,https://www.etsy.com/listing/698642627/black-leather-set-of-waist-bags-hip
Modern table lamp with clock and wireless charging.,"home,wishlist",home,home,Link-Only,https://articture.com/products/khonsu-clock-lamp-w-wireless-charging
"Medicine-themed mug gifts for medical professionals, perfect for graduation or ceremony occasions.","aesthetics,birthday gifts",gifts,gifts,Celebrity Lore,https://themedicinemug.com/products/medicine-mug
broken link,delete,delete,literature,Miscellaneous Notes,https://www.facebook.com/100002170207820/posts/4361709617244669?d=n
Tokyo's robot caf� employs people with disabilities remotely.,"bucket list,frontier,humanity,wholesome",bucket list,frontier,Innovation,https://www.instagram.com/p/C2yST_bJ0Gc?igsh=MXJkbHZucTA3ZDNzaA==
"Banofi Leather, Indian startup, wins Hult Prize for sustainability.","business,environment,frontier,indian",frontier,k-pop,Content Creation,https://www.instagram.com/reel/C4iapvTrDiy?igsh=c2FmdWtmOHVraXll
Penny Dreadful video with love quotes and gothic themes on Instagram.,"edits,relationships,series",edits,celebrity lore,Content Creation,https://www.instagram.com/p/BnRFZ_jDAex?igshid=ZTlkMDEyOTY=
Highlighting Samsung Galaxy Buds 2 with stylish cases.,"aesthetics,wishlist",aesthetics,design,Suggest new folder: Gadgets,https://www.instagram.com/reel/CXlKWwiFU0f?igshid=MDJmNzVkMjY=
"Song recommendations for fans of Benson Boone's ""Beautiful Things.""","music,watchlist",music,music,Music,https://www.instagram.com/reel/C6enf8LOszG?igsh=MWtvdGx5cHhkOTlicw==
broken link,delete,delete,travel,Travel Locations,https://www.instagram.com/p/CpnHscUKfHA?igshid=ZTlkMDEyOTY=
broken link,delete,delete,aesthetics,Fashion,https://www.etsy.com/listing/1017439263/black-on-black-apple-watch-band-or
Ryan Carl shares type sketch and pattern exploration.,"art tutorials,design",art tutorials,art tutorials,Art,https://www.instagram.com/p/B5-imHghwlT?igshid=ZTlkMDEyOTY=
broken link,delete,delete,aesthetics,Content Creation,https://www.facebook.com/marketplace/item/769007525177318
broken link,delete,delete,aesthetics,Content Creation,https://www.facebook.com/marketplace/item/216777191529584
broken link,delete,delete,art appreciation,Beauty,https://www.etsy.com/listing/239682186/disney-nail-decals-set-of-50-a1211?id=31704
Red Panda's Instagram post featuring cool content with credits to unknown creators.,animals,animals,art appreciation,Content Creation,https://www.instagram.com/reel/C0SAZENBgZb?igsh=cWRtdnVtcGZqd3Zh
Pre-order unique NCT-themed woven blankets for K-pop fans' rooms.,"business,kpop",art tutorials,design,K-pop,https://www.instagram.com/reel/C3p-vaNu4ky?igsh=bGR0cGI2MDUzeWEx
broken link,delete,delete,videos to recreate,Content Creation,https://www.instagram.com/reel/Cc6evvuo1Ji?igshid=MDJmNzVkMjY=
broken link,delete,delete,profiling,Content Creation,https://www.instagram.com/reel/CeD9my6p2gC?igshid=MDJmNzVkMjY=
broken link,delete,delete,art appreciation,Content Creation,https://www.instagram.com/reel/CYsvvcNJ4-b?igshid=MDJmNzVkMjY=
Kaitlyn's upcycling project turns a basic Uniqlo bag into a lace dream.,"diy,fashion",fashion,fashion,Fashion,https://www.instagram.com/reel/C-dCQXjP8B3?igsh=MW9lcnF0ajNlc3hwcg==
Embracing teen angst while healing inner child and teenager.,mental health,mental health,mental health,Therapy,https://www.instagram.com/reel/Ck5vH6RLaak?igshid=MDJmNzVkMjY=
a beluga whale joined this wedding ceremony,"animals,bucket list,wedding",wedding,wedding,Link-Only,https://www.instagram.com/reel/CtG_ZkwpGSQ?igsh=MTc4MmM1YmI2Ng==
broken link,delete,delete,art appreciation,New Folder Suggestion: Social Media,https://www.instagram.com/p/CmEnjTULTr5?igshid=ZTlkMDEyOTY=
broken link,delete,delete,art appreciation,New Folder Suggestion: Social Media,https://www.instagram.com/p/B2hKkRKB4Be?igshid=ZTlkMDEyOTY=
broken link,delete,delete,art appreciation,Content Creation,https://www.instagram.com/p/CBvNL_qg_Ue?igshid=ZTlkMDEyOTY=
One Piece scene where Zoro started looking for himself,"anime,edits,funny",edits,art appreciation,Content Creation,https://www.instagram.com/reel/Ccxz_DSINBG?igshid=YmMyMTA2M2Y=
broken link,delete,delete,art appreciation,Content Creation,https://www.instagram.com/p/B0GZuX1Fv0a?igshid=ZTlkMDEyOTY=
Weekend vibes at Walk Street House captured beautifully on Instagram.,architecture,architecture,architecture,Photography,https://www.instagram.com/p/CBWNCLbJ5Fj?igshid=ZTlkMDEyOTY=
Dining with strangers and overcoming fear through rejection therapy.,lifestyle design,lifestyle design,lifestyle design,Content Creation,https://www.instagram.com/reel/C2GB79upo0Q?igsh=MWlsMHNyMmYxMDZqcQ==
she styles a trash bag Discover the unique trash bag core aesthetic by Adele Diey.,fashion,fashion,celebrity lore,Fashion,https://www.facebook.com/reel/936897954145608?fs=e&mibextid=q5o4bk&s=aEkTS0
