note,tags,folder,current_folder,ai_suggested_folder,url
GirlsSetups Facebook page highlights gaming setups for girls.,"aesthetics,home,wishlist",home,games,Suggest new folder: Gaming,https://www.facebook.com/GirlsSetups
Reading patterns in stars and design via Established Magazine.,"academia,art,design,space",space,reading,Design,https://www.instagram.com/p/CFH1SxNJvAX?igshid=ZTlkMDEyOTY=
Instagram showcasing period drama and classic literature appreciation.,literature,literature,literature,Photography,https://www.instagram.com/p/CnoM6CVKzfi?igshid=MDJmNzVkMjY=
Wively Malaysia shares advice on listening to women.,"boyfriend goals,feminism,kdrama,masculinity",masculinity,profiling,Celebrity Lore,https://www.instagram.com/reel/C4kU0xZyt3F?igsh=MTdwbmV4YWFqczc4
"Haikyuu dancing video edit featuring Sugawara, source: TikTok.","anime,dance,edits",edits,dance trends,Dance,https://www.instagram.com/reel/COTZHutqXqv?igshid=ZDhmZGIxNmQ=
An artistic take on zodiac signs by Little Paper Forest.,"art,art tutorials,business",art tutorials,art tutorials,Art,https://www.facebook.com/509267292452292/posts/4977846928927617?d=n
A guide to the perfect high school graduation gifts for her to celebrate her achievement.,gifts,gifts,gifts,Parenting,https://www.society19.com/high-school-graduation-gifts-for-her-you-should-give
Aesthetic visuals from Aliya Fatima's Instagram profile.,"femininity,literature",femininity,visuals,Fashion,https://www.instagram.com/reel/C9VBS-aIawG?igsh=MW03YTY0cjMza2c0NQ==
Experience Ableton Live's 90-day free trial and learn its music production features.,"music,reading",music,music,Music,https://www.levelsmusicproduction.com/blog/what-is-the-ableton-live-90-day-free-trial
2 black koreans use their n-word pass hilariously,"funny,kpop",k-pop,about me,Content Creation,https://www.instagram.com/reel/CoL53jWu2rB?igshid=ZTlkMDEyOTY=
broken link,delete,delete,social skills,Content Creation,https://www.instagram.com/reel/CddZoChImyc?igshid=ZDhmZGIxNmQ=
broken link,delete,delete,aesthetics,Link-Only,https://www.instagram.com/reel/CQEcoiTn8HY?igshid=MDJmNzVkMjY=
white dotd makeup gets more tips,beauty,beauty,visuals,Beauty,https://www.instagram.com/reel/C4v9qZsOEuv?igsh=Zmt0cXlpbmU5bTZx
broken link,delete,delete,musician precedents,Content Creation,https://www.facebook.com/reel/1404194307128725
broken link,delete,delete,musician precedents,Content Creation,https://www.facebook.com/reel/1752811791889194
Crafting the perfect engagement ring.,"fashion,jewellery,rings",fashion,wedding,Jewellery,https://www.facebook.com/watch?ref=saved&v=819792209123230
Caroline shares “most important things i own” joy from simple things and moodboards on Instagram.,"content creation,content idea,moodboards",mood aesthetics,celebrity lore,Celebrity Lore,https://www.instagram.com/p/B7TyiEVHhHY?igshid=ZTlkMDEyOTY=
Borammyart transforms Levi Ackerman into a kpop idol with glam fanart featuring earrings and eyeliner.,"anime,art,business,kpop",art tutorials,art appreciation,Art Tutorial,https://www.instagram.com/reel/CLPYkzZJpBy?igshid=MDJmNzVkMjY=
Francesca shares psychology tricks on TikTok.,"communication,skills,social",social skills,profiling,Content Creation,https://fb.watch/bnLqTa9Wu-
Addressing map distortions due to Mercator's outdated cartographic projection.,"culture,history,politics",politics,productivity systems,Education,https://www.instagram.com/p/CbeqVQJKcp-?igshid=MDJmNzVkMjY=
Insights on communication from a 50-episode series.,"communication,social",social skills,social skills,Suggestion: Personal Growth,https://www.instagram.com/reel/C7X1g3ZPDm8?igsh=MTVyazRleWQ2bDV5MA==
Exploring the remote glacier regions of Tibet through Padma's diary.,"bucket list,nature,travel locations",bucket list,history,Travel Locations,https://m.facebook.com/story.php?id=100077298116984&story_fbid=pfbid0eAW2rXvPY65DhUdWWK8LoeK8vnPfKmiVoHTAmiS2TPr4KqGerJ4ynzCLSb9NZSjnl
Watch a pixel art transformation of Moon Knight.,art tutorials,art tutorials,art appreciation,Animation,https://m.facebook.com/story.php?id=100001135591786&story_fbid=pfbid0iryZAbwyanpRr9BszXDW4dCskNWrSDhxeJMbfuZSNE8dtxGVLgSVSzFsPswpSf73l
swimming through bioluminescent water,"bucket list,events,nature,travel",bucket list,mindset,Photography,https://www.instagram.com/reel/CvAUzHjgADN?igsh=MTc4MmM1YmI2Ng==
broken link,delete,delete,videos to recreate,K-drama,https://www.instagram.com/reel/Cn6s7XrJ-GQ?igshid=MDJmNzVkMjY=
broken link,delete,delete,positioning,Content Creation,https://www.instagram.com/reel/CRCVixeHNlu?igshid=MDJmNzVkMjY=
broken link,delete,delete,positioning,Content Creation,https://www.instagram.com/reel/CmE_4ITvPFv?igshid=MDJmNzVkMjY=
Coco Chanel and Salvador Dal� sharing a smoke in 1938 photo.,"history,photography",history,celebrity lore,Celebrity Lore,https://www.instagram.com/p/Bv9tj9qHOih?igshid=ZTlkMDEyOTY=
broken link,delete,delete,visuals,Content Creation,https://www.instagram.com/reel/CoNQPgVIYXT?igshid=ZTlkMDEyOTY=
broken link,delete,delete,design,Academia,https://info.lewagon.com/web-development-course-cpt2
death painted in white textpost,"art,history,literature,philosophy,textposts",literature,art appreciation,Content Creation,https://www.instagram.com/p/B0WKyyvn2xj?igshid=ZTlkMDEyOTY=
hongjoong described as  'shorty in blue.',"ateez,funny,kim hongjoong,kpop,lgbt",k-pop/ateez,gifts,Suggest a new one: Anniversaries,https://x.com/yeodior/status/1768691829170389349?s=12
"""How to Save a Life"" by The Fray, a classic emotional rock track from 2005.",music,music,musician precedents,Music,https://www.youtube.com/watch?v=ae7AACP1-R0
when her wig fell off in an interview and she dropped the most elegant n word,"funny,iconic,stims",culture,visuals,Beauty,https://www.instagram.com/reel/Ck8mt3lr9ZE?igshid=MDJmNzVkMjY=
broken link,delete,delete,visuals,Fashion,https://www.instagram.com/reel/C0sXmtZuP6-?igsh=MWV3Z2EybmZ0NmFrbw==
haikyuu meet the inarizaki second years,relationships,edits,art appreciation,K-pop,https://www.instagram.com/reel/CPiKXbfKBPa?igshid=ZDhmZGIxNmQ=
broken link,delete,delete,productivity systems,Tools,http://api-shein.shein.com/h5/sharejump/appjump?link=VbDTsuZir7J&localcountry=ZA&url_from=GM7526827697647484928
broken link,delete,delete,visuals,"Suggest ""Photography"" or ""Social Media""",https://www.instagram.com/reel/Cx8VbrjLrYU?igshid=MTc4MmM1YmI2Ng==
broken link,delete,delete,workouts,Suggest new folder: Social Media,https://www.instagram.com/reel/Cldyxj9spLX?igshid=MDJmNzVkMjY=
Instagram post featuring Eva Green in monochrome style.,"celebrity lore,photography",celebrity lore,aesthetics,Fashion,https://www.instagram.com/p/CklHdotr1Jz?igshid=MDJmNzVkMjY=
Aldynsay shares engaging content on Instagram with mystery and intrigue.,"body positivity,dance",dance,content creation,Suggest Social Media Trends,https://www.instagram.com/reel/C8ou-FloHQs/?igsh=NmQ0cTBsNmpjeTlh
broken link,delete,delete,art tutorials,Photography,http://www.lomography.com/magazine/tipster/2013/08/02/let-your-creativity-show-in-an-instax
broken link,delete,delete,home,Shopping Inspiration,https://www.etsy.com/listing/574281730/metal-wall-art-geometric-animal-head
Viral Instagram post featuring amazing transformer costume.,cosplay,cosplay,fashion,Fashion,https://www.instagram.com/reel/CrTZdfKAd0-?igsh=MTc4MmM1YmI2Ng==
Cleo Wade's post on body positivity and gratitude.,"body positivity,literature",literature,literature,Beauty,https://www.instagram.com/p/B5eJadap0Da?igshid=ZTlkMDEyOTY=
An Instagram post highlighting the dynamics of introvert-extrovert relationships.,"boyfriend goals,relationships",relationships,relationships,Friendship,https://www.instagram.com/reel/CqHRMWzvJIR?igshid=MDJmNzVkMjY=
broken link,delete,delete,design,Content Creation,https://www.reddit.com/r/rss/comments/rs31qa/is_there_a_way_to_create_rss_feed_for_tiktok
lucia does a makeup transition explanation tutorial,"content creation,video editing",video editing,art appreciation,Photography,https://www.instagram.com/reel/C-77RJrPnc6/?igsh=N2I5YnZka3hxZTk1
dog puts toys away when home alone Dog training video showing Ayce putting toys away.,animals,animals,animals,Pets,https://www.facebook.com/share/r/15ZWBDGkkS/?mibextid=wwXIfr
Delve into the fascinating world of Devil's Flower Mantids.,animals,animals,profiling,Photography,https://www.facebook.com/groups/523847131857861/permalink/987886765453893
Discover business opportunities and ventures in Spain with New Ventures Worldwide.,"career,jobs,travel",career,career,Travel Locations,https://newventuresworldwide.com/home/spain?fbclid=PAAab-nlstIP598nPRi-0YQ09YQ68XGVbFUq6gF6asW1xuuZbLSe5C9SBeCAo_aem_AW_hcO048zqKtA0vq-uAunlZpGmO_GSzZGIR2TAFNBY3BVrXwWNjI_9__PksvJ86ZPzPX6ItlX3S0E7-7TrVCoG_xNE-u2QV0fvF1M_SLYObv5D3St7mrzAsanWa0tExIeATd1NDOZX3p7BiCuJz9Fa4
broken link,delete,delete,hair,Beauty,https://www.instagram.com/reel/CiOf6Uzpo1V?igshid=ZDhmZGIxNmQ=
Creative edit focusing on a lesbian relationship in K-drama.,"edits,kdrama,lgbt",edits,visuals,K-pop,https://www.instagram.com/p/Cf9Or0yoIo6?igshid=MDJmNzVkMjY=
Ballerina Michaela DePrince's impactful life and career remembered after her sudden death.,"history,sports",history,celebrity lore,Dance,https://www.instagram.com/reel/C_-xxfnMy-i/?igsh=bXh5NXdjYjkxOWV0
Instagram post on a modern loft apartment with smart themes.,"aesthetics,architecture,home",architecture,aesthetics,Content Creation,https://www.instagram.com/reel/Cqf5hxEpf8t?igshid=ZTlkMDEyOTY=
full alphabet of the live love laugh variants ,"culture,language,memes",language,visuals,Content Creation,https://www.instagram.com/p/Cyx2C9ruq4h?igsh=MTc4MmM1YmI2Ng==
broken link,delete,delete,visuals,Content Creation,https://www.instagram.com/p/CJG_qFSjFSS?igshid=MDJmNzVkMjY=
broken link,delete,delete,content creation,Content Creation,https://www.reddit.com/r/Notion/comments/kzsh52/how_to_embed_an_rss_feed_into_notion
broken link,delete,delete,art appreciation,Photography,https://www.instagram.com/p/DBzCVsCNjry/?igsh=MW85dXRxYXpxOTg1Ng==
broken link,delete,delete,space,Suggestion Needed: Refugee Studies,http://www.refugeespaces.org
broken link,delete,delete,mental health,Wellness (suggested new folder),https://www.instagram.com/p/Cs-0oqWBLji?igshid=MTc4MmM1YmI2Ng==
broken link,delete,delete,aesthetics,Fashion,https://www.instagram.com/p/C_JwhKpsXGO/?igsh=MXBnYnl4dWM5bm9lcg==
pantihose over camera lens,photography,photography,art appreciation,Photography,https://www.instagram.com/reel/CgAX3onjw8H?igshid=ZTlkMDEyOTY=
broken link,delete,delete,boyfriend challenges,Challenges,https://www.instagram.com/reel/C5XafjXOwUl?igsh=bDZzNXBib2xheHlj
Merlin and Arthur praised in an Instagram photo post.,"edits,series",edits,aesthetics,Content Creation,https://www.instagram.com/p/B0MUHreICUx?igshid=ZTlkMDEyOTY=
The Larissa Necklace features brilliant-cut diamonds set in white gold.,"fashion,jewellery",fashion,wholesome,Fashion,https://www.colettejewelry.com/products/larissa-necklace?variant=8826150125629
Submitting a fun nerf challenge reel for Army recruiting.,games,games,videos to recreate,Challenges,https://www.instagram.com/reel/DGW5v-RtGMx/?igsh=MWNjMTUzNndnYjVvag==
Shop the chic Black Fluted Maxi Skirt by GUDU at Moda Operandi.,fashion,fashion,fashion,Fashion,https://www.modaoperandi.com/women/p/gudu/fluted-maxi-skirt/581542
"A wholesome story about two identical infants on Tumblr, authored by dycefic.","literature,wholesome",literature,friendship,Friendship,https://www.facebook.com/540862596/posts/10159794999242597?d=n
broken link,delete,delete,fashion,Fashion,https://www.etsy.com/shop/KyraVivianStudio
broken link,delete,delete,content creation,Content Creation,https://www.instagram.com/reel/CnKKEnbrZ0z?igshid=ZDhmZGIxNmQ=
broken link,delete,delete,home,Business,https://www.instagram.com/reel/C35oGF_voh3?fbclid=IwZXh0bgNhZW0CMTAAAR31XJXCDx8ZDboOGWrRi9w1jRL-jA8VMTVexd3j-oxLAQ3RK8sZlK5kz-s_aem_AQw7nudQR1Yfe8Hq2RZCp4cIhtZXyPF9wLbopWLqI9Sbjy6IWLF2CJgW1dURvhZLq-6rFyP5euWDCxvp3XzPGr6C
i love the woman im becoming but i think about past self video trend ,"about me,videos to recreate",videos to recreate,content creation,Content Creation,https://www.instagram.com/reel/CTlEiA8p7-N?igshid=MDJmNzVkMjY=
broken link,delete,delete,design,Content Creation,https://www.instagram.com/reel/CoXaO_3DTYx?igshid=MDJmNzVkMjY=
broken link,delete,delete,positioning,Content Creation,https://www.instagram.com/reel/C1ZuHgYtYiM?igsh=b3U0aG11eWoyMnBh
Natasha talks about a fresh morning routine with a Cucumber & Mint Skin Toner.,skincare,skincare,hair,Beauty,https://www.instagram.com/reel/C9nlTw8xHCL/?igsh=c2U5NWNxcHpsbmU0
The seamstress who advanced octopus intelligence study.,"academia,animals,history",animals,frontier,Academic Research,https://www.themarginalian.org/2022/12/26/jeanne-villepreux-power-argonaut?fbclid=IwAR0oynxDi2FDyjS1TUavvYXqRQ0Z0E2Y5cZZXr8rXEuPnMnbMZMAqxPzp-Q
an interview in 1950 with a man born in 1850,"antiaging,history,mindset",mindset,art appreciation,Content Creation,https://www.instagram.com/reel/C-8K-EWt-a0/?igsh=MWxub2ZicDExMXQ2cg==
A mesmerizing hair trend video with glitter and inspiration galore.,hair,hair,videos to recreate,Beauty,https://www.instagram.com/reel/CdErXxbFHge?igshid=MDJmNzVkMjY=
Stunning bathroom remodel featuring skylights for an outdoor shower feel.,"architecture,home",architecture,architecture,Beauty,https://www.instagram.com/reel/C3RZ2ZJNGl1?igsh=MXJhajRidzJkbm96bg==
A viral Instagram post of a creative Google Street View costume.,"cosplay,culture,funny,memes",cosplay,aesthetics,Photography,https://www.instagram.com/p/CkZfP8bylrx?igshid=ZDhmZGIxNmQ=
Highlights from a cosplayer's journey at C2E2 2024 costume competition.,cosplay,cosplay,fashion,Fashion,https://www.instagram.com/p/C6Z6DnCsgKj?igsh=bDJkNnBpOW8xOHU3
Instagram post comparing vintage Chanel looks between Penelope Cruz and Lily-Rose Depp.,"celebrity lore,high fashion",fashion,celebrity lore,Fashion,https://www.instagram.com/p/ByN8fLoIHEt?igshid=ZTlkMDEyOTY=
broken link,delete,delete,culture,History,https://en.wikipedia.org/wiki/Shlom_Native_Eating_House
Downloadable mandala bracelet tattoo design for personalized ink.,"art,business",business,art appreciation,Art,https://www.etsy.com/listing/937704100/tattoo-design-mandala-bracelet-with?ref=pla_sameshop_listing_top-1
broken link,delete,delete,positioning,Content Creation,https://www.instagram.com/reel/CggWA02gj5g?igshid=ZDhmZGIxNmQ=
Exploration of scary elements across European countries' maps.,"architecture,bucket list,culture,travel locations",bucket list,safety,Suggest a new folder: Maps,https://www.reddit.com/r/MapPorn/comments/qjl1ex/the_scariest_thing_in_every_european_country
broken link,delete,delete,fashion,Fashion,https://www.instagram.com/reel/C79h_cQoH1G?igsh=cHdkMWZqZmFjNWU4
"Pink fire opal pocket watch necklace, a perfect gift for her.","aesthetics,fashion,jewellery,wishlist",fashion,fashion,Fashion,https://www.etsy.com/uk/listing/118279831/pocket-watch-locket-style-necklace-pink
Ideas for black-themed Christmas decorations.,"aesthetics,events,home",aesthetics,gifts,Home,https://www.facebook.com/525232967642678/posts/2010832635749363?d=n
Creative and genius thrifting flip ideas.,"architecture,art,business,design",business,fashion,Fashion,https://fb.watch/cEIuAt96ue
Manage references using Python and Notion.,productivity,productivity systems,career,Academia,https://github.com/thomashirtz/notion-scholar
Essential emergency numbers for South Africa for crisis situations.,safety,safety,language,Travel Locations,https://www.thesouthafrican.com/news/emergency-numbers-in-south-africa
japanese easy listening mornjng vlog,"japan,language learning",language,language,Technology,https://www.reddit.com/r/LearningJapanese/comments/o3nrjt/n5n4_easy_japanese_listening_vlog_morning_routine
broken link,delete,delete,visuals,Celebrity Lore,https://www.instagram.com/p/CBTMDzugolw?igshid=ZTlkMDEyOTY=
Shop Cucculelli Shaheen women's collection at Moda Operandi.,"fashion,high fashion",fashion,fashion,Fashion,https://www.modaoperandi.com/cucculelli-shaheen-fw18#lkcell-157351
broken link,delete,delete,hair,Beauty,http://www.buzzfeed.com/ruthyanney/21-man-buns-that-will-ruin-you-for-short-haired-gu-118s9
"Instagram post with a single word caption, ""Tobio.""","anime,edits",edits,art appreciation,Content Creation,https://www.instagram.com/reel/CPYiTLVldLV?igshid=ZDhmZGIxNmQ=
broken link,delete,delete,language,K-pop,https://www.instagram.com/reel/Cium72fhJ8L?igshid=NjQxMzA2Mjk=
Face Clothing UK collaborates with Gemma Hawkins for a new collection.,"business,fashion",business,celebrity lore,Fashion,https://www.instagram.com/p/B27L-5wBaO4?igshid=ZTlkMDEyOTY=
Learn to do a backflip in five steps from Instagram trainers.,"exercise,fitness,movement",fitness,dance trends,Dance,https://www.facebook.com/watch?ref=saved&v=2861626490764331
Discover color psychology for your home in Melanie Jade Design's eBook.,"architecture,design",architecture,reading,Home,http://melaniejadedesign.com
Explore the types of Goths by artist @hellga_protiv.,"aesthetics,art,moodboards",aesthetics,aesthetics,Art,https://www.facebook.com/101999514829957/posts/pfbid02o9ahe28g5HBjHoij31MMVSv9aLuSqUH1hkiqrRxkCPSFhJWxGLEe4HqqtwXnVwfNl?d=n
"Clip of Teresa Graves & David Niven from ""Vampira"" (1974).","aesthetics,celebrity lore,cinema,history",celebrity lore,celebrity lore,Cinema,https://www.instagram.com/reel/C3oDkLYPd4p?igsh=MXducWZxYmp5a2lucg==
Instagram reflective post on the concept of time lag.,"lifestyle design,mindset",lifestyle design,aesthetics,Concepts,https://www.instagram.com/p/C9hcOT9imBd?igsh=MXV6aGpnN2tnbDg0eQ==
broken link,delete,delete,art appreciation,Instagram Posts,https://www.instagram.com/p/BuJxCO3A-Ga?igshid=ZTlkMDEyOTY=
broken link,delete,delete,dance appreciation,Dance,https://www.instagram.com/reel/C0zadQZK70c?igsh=OHRmemE4dHpnZzMw
Miss Thailand wears soda tab gown at Pageant.,"environment,frontier,high fashion",fashion,fashion,Fashion,https://www.instagram.com/p/DDLde5XiSJO/?img_index=3&igsh=MXR5ZTNvZnF3eW02bg==
broken link,delete,delete,wholesome,Fashion,https://www.instagram.com/p/BysOpCjHdxu
broken link,delete,delete,art appreciation,Memes (suggested),https://www.instagram.com/reel/C0oOIGZP8_B/?igsh=aGYwa29tYjBuc3Vh
Elegant chandelier earrings by Diana Caldarescu.,"aesthetics,fashion",fashion,art appreciation,Fashion,https://www.facebook.com/groups/523847131857861/permalink/993996431509593
John W Thompson in Sydney specializes in custom signet rings.,"aesthetics,fashion,jewellery",fashion,aesthetics,Jewellery,https://www.johnwthompson.net/signet-rings
broken link,delete,delete,video editing,Music,https://www.instagram.com/reel/Cay5TtRFT0K?igshid=MDJmNzVkMjY=
"Wallows delivers an exclusive live performance of ""Calling After Me"" for Vevo.",music,music,stagecraft,Music,https://www.youtube.com/watch?v=jTYgkePilRg
broken link,delete,delete,art appreciation,Design,https://www.etsy.com/listing/841952796/globoards-gaming-decor-room-decor-wall?awc=6220_1652171959_8d25930b2d81d0511763d570c2502fcd&show_sold_out_detail=1&source=aw
broken link,delete,delete,beauty,Beauty,https://www.instagram.com/reel/ChnRQ-OlvMt?igshid=MDJmNzVkMjY=
broken link,delete,delete,masculinity,Content Creation,https://www.instagram.com/reel/C6GddEny4rp/?igsh=bW1tNGR2ajV5NGh5
Description of stackable rose gold lilac vine ring.,"aesthetics,fashion,jewellery,rings",fashion,fashion,Fashion,https://www.lovisajewellery.co.za/products/rtr-rg-vine-wrap-rg
Focus on Kenma's role in upcoming Haikyuu season with TikTok credits.,"anime,edits",edits,celebrity lore,Content Creation,https://www.instagram.com/reel/CLzH7Y3FO4t?igshid=ZDhmZGIxNmQ=
broken link,delete,delete,content creation,Suggest new: Social Media,https://www.instagram.com/reel/CyluI6gKL3P?igshid=MTc4MmM1YmI2Ng==
broken link,delete,delete,content creation,Suggest new: Social Media,https://www.instagram.com/reel/CnuMHkthi51?igshid=MDJmNzVkMjY=
broken link,delete,delete,content creation,Suggest new: Social Media,https://www.instagram.com/reel/Co4L_pktppB?igshid=MTc4MmM1YmI2Ng==
broken link,delete,delete,content creation,Suggest new: Social Media,https://www.instagram.com/reel/CnuAMfBIgWw?igshid=MDJmNzVkMjY=
broken link,delete,delete,content creation,Suggest new: Social Media,https://www.instagram.com/reel/CurnXAYAgpY?igshid=MTc4MmM1YmI2Ng==
Instapost celebrating the diverse experiences of girlhood.,"about me,academia,femininity,literature,textposts",about me,visuals,Content Creation,https://www.instagram.com/p/C9SFG7tzLb3?igsh=MXYwMzdza285b3J1Ng==
broken link,delete,delete,art appreciation,Celebrity Lore,https://www.instagram.com/p/CBa_CRCFpCS?igshid=ZTlkMDEyOTY=
broken link,delete,delete,history,Academia,https://www.instagram.com/p/B-5GocfA2Wb?igshid=ZTlkMDEyOTY=
"League of Legends 2025 cinematic featuring ""Bite Marks"".",music,music,dance appreciation,Music,https://www.youtube.com/watch?v=I76wvt0aEE4
Mathew Martorana explores the impact of childhood wounds on personal development.,"mental health,parenting",mental health,mental health,Mental Health,https://www.instagram.com/reel/C75GR59MID1?igsh=MXVzbWFjZ2RyNmdleA==
broken link,delete,delete,art appreciation,Content Creation,https://www.instagram.com/reel/CTZX3jSH6wc?igshid=ZDhmZGIxNmQ=
Enjoying nature with forest light and mindful hiking adventures.,"bucket list,nature,photography,travel",aesthetics,travel,Travel Locations,https://www.instagram.com/reel/CizjaCMjrFE?igshid=NjQxMzA2Mjk=
Enjoying nature with forest light and mindful hiking adventures.,"bucket list,nature,photography,travel",aesthetics,history,Celebrity Lore,https://www.instagram.com/p/B-2iaBtl5Z4?igshid=ZTlkMDEyOTY=
broken link,delete,delete,aesthetics,Content Creation,https://www.instagram.com/p/CT7H2ODl0sh?igshid=ZDhmZGIxNmQ=
A new performing arts center by Ankita Das.,architecture,architecture,art appreciation,Stagecraft,https://www.behance.net/gallery/82811655/Performing-Arts-Center
brooklyn99 post for happy fathers day,"celebrity lore,edits,fandom",edits,celebrity lore,Celebrity Lore,https://www.instagram.com/p/C8SFsFpB2Lh
cillian murphy accepting his award with lipstick on his face is wholesome,"boyfriend goals,celebrity lore",celebrity lore,visuals,Friendship,https://www.instagram.com/reel/C117hLKoLs9?igsh=ZHI0aDNteGs4cTc2
broken link,delete,delete,positioning,Content Creation,https://www.instagram.com/reel/CZMZ325K97B?igshid=ZDhmZGIxNmQ=
broken link,delete,delete,positioning,Content Creation,https://www.instagram.com/reel/CjTwIg_qjfm?igshid=ZDhmZGIxNmQ=
Advice for training dogs to improve behavior and obedience.,"animals,pets",animals,animals,"Suggest creating a new folder ""Pets & Training""",https://www.instagram.com/reel/CrTbaMGJHro?igshid=MDJmNzVkMjY=
broken link,delete,delete,fashion,Suggest a new folder,https://www.etsy.com/ca/listing/1539555211/y2k-gold-star-nails-japanese-nails
Aquamarine ring with watermelon tourmaline and diamonds by Janine Binneman.,"fashion,jewellery,rings",fashion,aesthetics,Fashion,https://www.instagram.com/p/CpXjbloKplR?igshid=MDJmNzVkMjY=
Contains spoilers for AOT Episode 5 and highlights compositions.,"anime,edits",edits,art appreciation,Content Creation,https://www.instagram.com/p/CJ6L5xIF8UA?igshid=ZDhmZGIxNmQ=
broken link,delete,delete,k-pop,Architecture,https://www.instagram.com/p/CPZsT__gniq?igshid=MDJmNzVkMjY=
broken link,delete,delete,art appreciation,Photography,https://www.instagram.com/reel/CiuXWokvVnF?igshid=ZDhmZGIxNmQ=
"""Shinunoga E-Wa"" by Fujii Kaze, a Universal Sigma release.",music,music,stagecraft,Music,https://www.youtube.com/watch?v=3zh9Wb1KuW8
broken link,delete,delete,art appreciation,Suggestion needed,http://www.tea-makipaa.eu/Parasite/Parasite
astronauts readjusting to gravity,"frontier,funny,space",space,visuals,Content Creation,https://www.instagram.com/p/B_-Ka54nuis?igshid=ZTlkMDEyOTY=
"Relive 1962 with Paul Anka's iconic ""Put Your Head on My Shoulder.""","history,music",music appreciation,music appreciation,Music,https://www.instagram.com/p/B_u1xpHlov2?igshid=ZTlkMDEyOTY=
Tips for constructive disagreeing in conversations.,"communication,social",social skills,friendship,Communication,https://www.instagram.com/reel/C7MwtDDOtdC?igsh=aWQwZ2p1bnVzd2k4
Fae-themed mushroom pins inspired by real fungi.,"aesthetics,art tutorials",art tutorials,art appreciation,Art,https://www.facebook.com/groups/fae.propaganda/permalink/1107177336521811
broken link,delete,delete,reading,Academia,https://www.facebook.com/reel/383072584495936
broken link,delete,delete,content creation,Content Creation,https://www.instagram.com/reel/C2xe0ivPUkc?igsh=MXBrcDhuaGk1ZHd1Yw==
Unidentified spider spotted in Lanseria; first encounter noted.,"animals,nature",animals,bucket list,Travel Locations,https://www.facebook.com/share/p/iKRbfNhhLjfFsaNs?mibextid=WC7FNe
haikyuu fanart of hinata captioned improvement ,"anime,art,edits,fandom",art tutorials,art appreciation,Content Creation,https://www.instagram.com/p/CRPqytNA2zf?igshid=ZDhmZGIxNmQ=
broken link,delete,delete,art tutorials,Beauty,https://www.letseatcake.com/black-halloween-nails
Zoe Kim Kenealy's semi grunge goth makeup tutorial reel on Instagram.,"beauty,cosplay,personal style",beauty,celebrity lore,Beauty,https://www.instagram.com/reel/CiwgwYNNPyC?igshid=MDJmNzVkMjY=
Customized Princess Diana necklace available for purchase.,"aesthetics,jewellery",fashion,aesthetics,Fashion,https://www.instagram.com/reel/Cn6GitGsiCY?igshid=MDJmNzVkMjY=
"Shop for handmade Russian axes on Etsy, top-rated by satisfied buyers.","aesthetics,safety",aesthetics,fashion,Celebrity Lore,https://www.etsy.com/shop/RussianAxe?feed_id=36&p=82
Expanding Notion for reading multiple RSS endpoints.,productivity,productivity systems,design,Content Creation,https://medium.com/geekculture/transform-notion-into-rss-reader-part-2-multiple-rss-endpoints-de3406786845
broken link,delete,delete,frontier,[Suggest new: Technology],http://api-shein.shein.com/h5/sharejump/appjump?link=V4xc1SazUEL&localcountry=ZA&url_from=GM7478998988722716672
